### DISCUSSION TITLE
Server `DataValue.Status` Usage

### DISCUSSION THREAD

**Discussion by iread-do** [gopcua/opcua#765] [Q&A] [answered]
👋  Hello, thanks for developing this project. 

I'm writing a server implementation, and I've found that setting the `DataValue.Status` does not seem to send to the client (in this case Ignition Automation). The value is clearly being sent correctly, so that confirms connection, but my client displays `Good` Quality no matter what I set the StatusCode value to.

It's possible i'm misinterpreting what `Quality` in the OCPUA client means, for example will `Quality` always be `Good` as long as data is recieved. 

Is the `Status` field currently supported? 

```go 
	var st = ua.StatusBad
	val := ua.DataValue{
		Value:           ua.MustVariant(v.instMag),
		SourceTimestamp: v.t,
		Status:          st,
		EncodingMask:    ua.DataValueValue | ua.DataValueSourceTimestamp | ua.DataValueStatusCode,
	}
	n.SetAttribute(ua.AttributeIDValue, val)
```

<img width="243" alt="image" src="https://github.com/user-attachments/assets/d605b058-59ac-452a-8f54-74b9cf336b1e" />

Thanks!

**Comment by magiconair** [comment]
Hmm, good question. Can you provide a `tcpdump`?

**Reply by iread-do** [reply]
👀 yes I will see what I can get, thanks for the quick response.

**Reply by iread-do** [reply]
Any specific options for tcpdump that would help? 

```
tcpdump -i eth0 -nn port 4840
tcpdump: verbose output suppressed, use -v[v]... for full protocol decode
listening on eth0, link-type EN10MB (Ethernet), snapshot length 262144 bytes
13:02:26.858934 IP 172.18.0.2.4840 > 172.18.0.3.34902: Flags [P.], seq 1682923764:1682923892, ack 489310037, win 614, options [nop,nop,TS val 3606502718 ecr 998646219], length 128
13:02:26.861164 IP 172.18.0.3.34902 > 172.18.0.2.4840: Flags [P.], seq 1:67, ack 128, win 715, options [nop,nop,TS val 998649221 ecr 3606502718], length 66
13:02:26.861234 IP 172.18.0.2.4840 > 172.18.0.3.34902: Flags [.], ack 67, win 614, options [nop,nop,TS val 3606502720 ecr 998649221], length 0
13:02:27.118121 IP 172.18.0.3.34902 > 172.18.0.2.4840: Flags [P.], seq 67:163, ack 128, win 715, options [nop,nop,TS val 998649478 ecr 3606502720], length 96
13:02:27.118160 IP 172.18.0.2.4840 > 172.18.0.3.34902: Flags [.], ack 163, win 614, options [nop,nop,TS val 3606502977 ecr 998649478], length 0
13:02:27.118565 IP 172.18.0.2.4840 > 172.18.0.3.34902: Flags [P.], seq 128:206, ack 163, win 614, options [nop,nop,TS val 3606502977 ecr 998649478], length 78
13:02:27.159878 IP 172.18.0.3.34902 > 172.18.0.2.4840: Flags [.], ack 206, win 715, options [nop,nop,TS val 998649520 ecr 3606502977], length 0
13:02:29.858909 IP 172.18.0.2.4840 > 172.18.0.3.34902: Flags [P.], seq 206:334, ack 163, win 614, options [nop,nop,TS val 3606505718 ecr 998649520], length 128
13:02:29.858952 IP 172.18.0.3.34902 > 172.18.0.2.4840: Flags [.], ack 334, win 715, options [nop,nop,TS val 998652219 ecr 3606505718], length 0
13:02:29.860129 IP 172.18.0.3.34902 > 172.18.0.2.4840: Flags [P.], seq 163:229, ack 334, win 715, options [nop,nop,TS val 998652220 ecr 3606505718], length 66
13:02:29.900858 IP 172.18.0.2.4840 > 172.18.0.3.34902: Flags [.], ack 229, win 614, options [nop,nop,TS val 3606505760 ecr 998652220], length 0
13:02:32.858852 IP 172.18.0.2.4840 > 172.18.0.3.34902: Flags [P.], seq 334:462, ack 229, win 614, options [nop,nop,TS val 3606508718 ecr 998652220], length 128
13:02:32.860101 IP 172.18.0.3.34902 > 172.18.0.2.4840: Flags [P.], seq 229:295, ack 462, win 715, options [nop,nop,TS val 998655220 ecr 3606508718], length 66
13:02:32.860159 IP 172.18.0.2.4840 > 172.18.0.3.34902: Flags [.], ack 295, win 614, options [nop,nop,TS val 3606508719 ecr 998655220], length 0
13:02:33.067414 IP 172.18.0.3.34902 > 172.18.0.2.4840: Flags [P.], seq 295:434, ack 462, win 715, options [nop,nop,TS val 998655427 ecr 3606508719], length 139
13:02:33.067516 IP 172.18.0.2.4840 > 172.18.0.3.34902: Flags [.], ack 434, win 637, options [nop,nop,TS val 3606508926 ecr 998655427], length 0
13:02:33.067839 IP 172.18.0.2.4840 > 172.18.0.3.34902: Flags [P.], seq 462:545, ack 434, win 637, options [nop,nop,TS val 3606508927 ecr 998655427], length 83
13:02:33.068961 IP 172.18.0.3.34902 > 172.18.0.2.4840: Flags [P.], seq 434:512, ack 545, win 715, options [nop,nop,TS val 998655429 ecr 3606508927], length 78
13:02:33.069206 IP 172.18.0.2.4840 > 172.18.0.3.34902: Flags [P.], seq 545:609, ack 512, win 637, options [nop,nop,TS val 3606508928 ecr 998655429], length 64
13:02:33.109737 IP 172.18.0.3.34902 > 172.18.0.2.4840: Flags [.], ack 609, win 715, options [nop,nop,TS val 998655470 ecr 3606508928], length 0
13:02:33.357989 IP 172.18.0.2.4840 > 172.18.0.3.34902: Flags [P.], seq 609:737, ack 512, win 637, options [nop,nop,TS val 3606509217 ecr 998655470], length 128
13:02:33.358048 IP 172.18.0.3.34902 > 172.18.0.2.4840: Flags [.], ack 737, win 715, options [nop,nop,TS val 998655718 ecr 3606509217], length 0
13:02:33.359339 IP 172.18.0.3.34902 > 172.18.0.2.4840: Flags [P.], seq 512:578, ack 737, win 715, options [nop,nop,TS val 998655719 ecr 3606509217], length 66
13:02:33.399746 IP 172.18.0.2.4840 > 172.18.0.3.34902: Flags [.], ack 578, win 637, options [nop,nop,TS val 3606509259 ecr 998655719], length 0
13:02:35.859038 IP 172.18.0.2.4840 > 172.18.0.3.34902: Flags [P.], seq 737:891, ack 578, win 637, options [nop,nop,TS val 3606511718 ecr 998655719], length 154
13:02:35.860407 IP 172.18.0.3.34902 > 172.18.0.2.4840: Flags [P.], seq 578:644, ack 891, win 715, options [nop,nop,TS val 998658220 ecr 3606511718], length 66
13:02:35.860456 IP 172.18.0.2.4840 > 172.18.0.3.34902: Flags [.], ack 644, win 637, options [nop,nop,TS val 3606511719 ecr 998658220], length 0
^C
27 packets captured
27 packets received by filter
0 packets dropped by kernel
```

**Reply by magiconair** [reply]
Could you provide the pcap file? I'd need to look into the packets.

**Reply by magiconair** [reply]
try `tcpdump -i eth0 -s 1520 -w dump.pcap port 4840`

**Reply by magiconair** [reply]
You might have to compress it with zip to attach it. Not sure.

**Reply by iread-do** [reply]
Sorry, took me a bit to figure out the capture. I made a generic test server to capture against, and subscribed to one node. 

[opcua_capture.pcap.zip](https://github.com/user-attachments/files/18608026/opcua_capture.pcap.zip)


Example server on port 4840:
```go
func main() {
	var port = 4840

	// Server options.
	opts := []server.Option{
		server.EnableSecurity("None", ua.MessageSecurityModeNone),
		server.EnableAuthMode(ua.UserTokenTypeAnonymous),

		// Endpoints.
		server.EndPoint("0.0.0.0", port),
		server.EndPoint("opcua", port),
	}

	// Create the server.
	s := server.New(opts...)

	// Add the root namespace.
	rootNS, _ := s.Namespace(0)
	rootObjNS := rootNS.Objects()

	// Add the tag namespace.
	tagNS := server.NewNodeNameSpace(s, "Tags")
	tagObjNS := tagNS.Objects()
	rootObjNS.AddRef(tagObjNS, id.HasComponent, true)

	// Add a tag.
	val := ua.DataValue{
		Value:           ua.MustVariant(206.1),
		Status:          ua.StatusBad,
		SourceTimestamp: time.Now(),
		EncodingMask:    ua.DataValueValue | ua.DataValueStatusCode | ua.DataValueSourceTimestamp,
	}
	n := tagNS.AddNewVariableNode("Voltage", val)
	tagObjNS.AddRef(n, id.HasComponent, true)

	if err := s.Start(context.Background()); err != nil {
		log.Fatalf("Error starting server: %v", err)
	}

	// simulate a background process updating the data in the namespace.
	go func() {
		time.Sleep(time.Second * 10)
		for {
			// wrap the new value in a DataValue and use that to update the Value attribute of the node
			val := ua.DataValue{
				Value:           ua.MustVariant(206.1),
				Status:          ua.StatusBad,
				SourceTimestamp: time.Now(),
				EncodingMask:    ua.DataValueValue | ua.DataValueStatusCode | ua.DataValueSourceTimestamp,
			}
			n.SetAttribute(ua.AttributeIDValue, val)

			// we also need to let the node namespace know that the value has changed so it can trigger the change notification
			// and send the updated value to any subscribed clients.
			tagNS.ChangeNotification(n.ID())

			time.Sleep(time.Second)
		}
	}()

	// catch ctrl-c and gracefully shutdown the server.
	sigch := make(chan os.Signal, 1)
	signal.Notify(sigch, os.Interrupt)
	defer signal.Stop(sigch)
	log.Printf("Press CTRL-C to exit")

	<-sigch
	log.Printf("Shutting down the server...")

}

```

**Comment by danomagnum** [comment]
When the server replies to a value attribute request, if it gets the value whatever it may be and then wraps it in a `ua.DataValue` where the status is always OK.

https://github.com/gopcua/opcua/blob/6b1ec73ddf559db00cd6e1ebfcad4ad180e6e8be/server/namespace_node.go#L160-L165

So it wraps your dataValue with another one.  I think we'd have to add a check to see if the value of the attribute is already a datavalue and not wrap it to support status per attribute.


Something like this.

```go
        dv, ok := a.Value.Value().(*ua.DataValue)
	if ok {
		return dv
	}
	return &ua.DataValue{
		EncodingMask:    ua.DataValueServerTimestamp | ua.DataValueStatusCode | ua.DataValueValue,
		ServerTimestamp: time.Now(),
		Status:          ua.StatusOK,
		Value:           a.Value,
	}
```


edit: ehhh... it looks like the datavalue type might be stripped when it is turned into a variant...


Yep, the lambda that holds the value strips off everything but the inner value when it returns.

https://github.com/gopcua/opcua/blob/6b1ec73ddf559db00cd6e1ebfcad4ad180e6e8be/server/node.go#L166

**Reply by iread-do** [reply]
Ah, that would do it. 

I can see why the DataValue is stripped off in the current implementation. I tried sending the DataValue itself, and the client receives the whole DataValue.

```go
// TODO: probably need to do some type checking here.
// And some permissions tests
n.val = func() *ua.Variant {
	return ua.MustVariant(&val)
}
```
<img width="1345" alt="image" src="https://github.com/user-attachments/assets/85a709cf-5cc5-49a5-b9a2-1ca0f1a7e349" />

**Reply by magiconair** [reply]
@danomagnum is there a reason it has to return `ua.StatusOK` for every request? What if you'd have to fetch the value from an API and that fails? Wouldn't you have to return an error code?

**Reply by danomagnum** [reply]
@magiconair It does.  if you go up a couple lines it returns a different status if the attribute isn't found.  There are a few other cases that give a different status code as well.  It was only returning statusOK every time if it found a result for the attribute being requested.

https://github.com/gopcua/opcua/blob/6b1ec73ddf559db00cd6e1ebfcad4ad180e6e8be/server/namespace_node.go#L115-L166

With the changes in the server_UseDVs branch, the status code comes with the attribute so it isn't always OK when it has a valid response.  The other conditions that return the other status codes remain.

**Comment by danomagnum** [comment]
The proof-of-concept for using DataValues instead of Variants is here: https://github.com/gopcua/opcua/tree/server_UseDVs

It's not quite right yet though.  Will have to investigate.  ~~It largely works but not everything does (namespace array isn't being returned properly anymore).~~  Got that fixed.

**Reply by iread-do** [reply]
I just tried this with my example server and it worked. Thanks for looking into this, i'll obviously await any investigation. 

<img width="1325" alt="image" src="https://github.com/user-attachments/assets/9451ae73-c77f-4ce3-94e9-3a141d935f73" />

**Comment by danomagnum** [comment]
I don't see any reason not to go with the datavalues all the way through.  It is all upside and just makes more sense as far as I can tell.  I put in a pull request to merge these changes (#766)

**Comment by danomagnum** [comment, marked as answer]
The change to using DataValues properly is live in v0.7
